{
  "lines": [
    {
      "line": "T1",
      "speed": 8,
      "headwaySec": 120,
      "dwellSec": 15
    },
    {
      "line": "S1",
      "speed": 12,
      "headwaySec": 90,
      "dwellSec": 12
    },
    {
      "line": "S2",
      "speed": 12,
      "headwaySec": 90,
      "dwellSec": 12
    }
  ],
  "journeys": [
    {
      "legs": [
        {
          "from": "T1/comet",
          "to": "T1/circus"
        },
        {
          "from": "S1/circus",
          "to": "S1/skyport"
        }
      ]
    },
    {
      "legs": [
        {
          "from": "T1/records",
          "to": "T1/circus"
        },
        {
          "from": "S1/circus",
          "to": "S1/gardens"
        }
      ]
    },
    {
      "legs": [
        {
          "from": "S1/skyport",
          "to": "S1/circus"
        },
        {
          "from": "T1/circus",
          "to": "T1/records"
        }
      ]
    },
    {
      "legs": [
        {
          "from": "S1/gardens",
          "to": "S1/circus"
        },
        {
          "from": "T1/circus",
          "to": "T1/comet"
        }
      ]
    },
    {
      "legs": [
        {
          "from": "T1/comet",
          "to": "T1/records"
        }
      ]
    },
    {
      "legs": [
        {
          "from": "S1/gardens",
          "to": "S1/skyport"
        }
      ]
    },
    {
      "legs": [
        {
          "from": "S2/docks",
          "to": "S2/market"
        }
      ]
    },
    {
      "legs": [
        {
          "from": "S2/docks",
          "to": "S2/market"
        },
        {
          "from": "T1/records",
          "to": "T1/comet"
        }
      ]
    },
    {
      "legs": [
        {
          "from": "T1/comet",
          "to": "T1/records"
        },
        {
          "from": "S2/market",
          "to": "S2/docks"
        }
      ]
    },
    {
      "legs": [
        {
          "from": "S2/docks",
          "to": "S2/market"
        },
        {
          "from": "T1/records",
          "to": "T1/circus"
        },
        {
          "from": "S1/circus",
          "to": "S1/skyport"
        }
      ]
    },
    {
      "legs": [
        {
          "from": "S1/skyport",
          "to": "S1/circus"
        },
        {
          "from": "T1/circus",
          "to": "T1/records"
        },
        {
          "from": "S2/market",
          "to": "S2/docks"
        }
      ]
    }
  ],
  "openQuestions": [
    {
      "question": "Does boarding cost anything besides the wait and the ride (fare, cooldown, Trail, Alert exposure at watched stations)?",
      "for": "Motive",
      "why": "GDD §02 says time only; the timetable prices only wait + ride, so any other cost is undecided here."
    },
    {
      "question": "Are there limits on who may ride (e.g. wanted persons, armed cells, injured members)?",
      "for": "Motive",
      "why": "The GDD says board at any stop, with no restriction stated; none is assumed."
    },
    {
      "question": "Is the interchange walk pace (1.4 m/s, [S]) acceptable, and is the wait for the next service after a change counted when pricing an order?",
      "for": "Motive",
      "why": "The GDD states no walking pace; journey totals exclude the wait at each change."
    }
  ],
  "notes": [
    "T1 speed 8 m/s: stops 300-500 m apart on a street-running double track with 25-50 m radii; runs of about 39 s read as street running. Dwell 15 s, headway 120 s [S].",
    "S1 speed 12 m/s: elevated, 24 m high, so faster than the tram and the quick option. Dwell 12 s, headway 90 s [S].",
    "S2 speed 12 m/s, dwell 12 s, headway 90 s [S]: same elevated mode as S1, so it keeps the same values. It has only two stations, 305 m apart. Its end loops have no stops.",
    "Interchange pairs: T1/circus with S1/circus (about 119 m) and T1/records with S2/market (about 72 m). Both are within the 150 m standard.",
    "The previous proposal had no S2 line and no S2 journeys. This round adds both, with journeys that use the second interchange.",
    "Journeys cover each tram end to each sky rail end in both directions, plus single-line rides. Code derives run times and totals; none are stated here.",
    "Not decided and not invented: fares, cooldowns, rider limits (see openQuestions). The scale and loop questions in the plan notes belong to Datum."
  ],
  "sources": [
    "d9cd5166b54ff42ba1ea56ae",
    "a61013bb832308b31e1ef07b",
    "7dfdfdf13043a24e8e964b0b",
    "538618090dd534247cab5493",
    "ba506de42600790962a866a2"
  ]
}
